{
	"$schema": "http://json-schema.org/draft-07/schema#",
	"$id": "https://json.schemastore.org/codex-plugin-manifest.json",
	"$comment": "Sources: https://github.com/openai/codex/blob/main/codex-rs/plugin/src/manifest.rs and https://github.com/openai/codex/blob/main/codex-rs/skills/src/assets/samples/plugin-creator/scripts/validate_plugin.py",
	"title": "Codex plugin manifest",
	"description": "Manifest for an OpenAI Codex plugin.",
	"type": "object",
	"required": ["name", "version", "description", "author", "interface"],
	"additionalProperties": false,
	"properties": {
		"id": {
			"type": "string",
			"minLength": 1,
			"description": "Optional plugin identifier."
		},
		"name": {
			"type": "string",
			"minLength": 1,
			"description": "Plugin identifier."
		},
		"version": {
			"type": "string",
			"pattern": "^(0|[1-9]\\d*)\\.(0|[1-9]\\d*)\\.(0|[1-9]\\d*)(?:-[0-9A-Za-z.-]+)?(?:\\+[0-9A-Za-z.-]+)?$",
			"description": "Strict semantic version."
		},
		"description": {
			"type": "string",
			"minLength": 1,
			"description": "Brief plugin description."
		},
		"skills": {
			"$ref": "#/definitions/relativePath",
			"description": "Relative path to skill directories or files."
		},
		"apps": {
			"$ref": "#/definitions/relativePath",
			"description": "Relative path to the app manifest."
		},
		"mcpServers": {
			"description": "Relative path to an MCP manifest or inline MCP server configuration.",
			"oneOf": [
				{
					"$ref": "#/definitions/relativePath"
				},
				{
					"type": "object",
					"additionalProperties": true
				}
			]
		},
		"interface": {
			"$ref": "#/definitions/pluginInterface"
		},
		"author": {
			"type": "object",
			"required": ["name"],
			"additionalProperties": false,
			"properties": {
				"name": {
					"type": "string",
					"minLength": 1
				},
				"email": {
					"type": "string",
					"minLength": 1
				},
				"url": {
					"$ref": "#/definitions/httpsUrl"
				}
			}
		},
		"homepage": {
			"$ref": "#/definitions/httpsUrl",
			"description": "Plugin documentation URL."
		},
		"repository": {
			"$ref": "#/definitions/httpsUrl",
			"description": "Plugin source repository URL."
		},
		"license": {
			"type": "string",
			"minLength": 1
		},
		"keywords": {
			"type": "array",
			"uniqueItems": true,
			"items": {
				"type": "string",
				"minLength": 1
			}
		}
	},
	"definitions": {
		"httpsUrl": {
			"type": "string",
			"format": "uri",
			"pattern": "^https://",
			"minLength": 1
		},
		"relativePath": {
			"type": "string",
			"minLength": 1,
			"not": {
				"pattern": "^(?:[A-Za-z]:|/|\\\\\\\\)"
			}
		},
		"assetPath": {
			"type": "string",
			"minLength": 1,
			"description": "Package-relative asset path."
		},
		"defaultPrompt": {
			"description": "Starter prompt shown by Codex clients.",
			"oneOf": [
				{
					"type": "string",
					"minLength": 1
				},
				{
					"type": "array",
					"minItems": 1,
					"maxItems": 3,
					"items": {
						"type": "string",
						"minLength": 1
					}
				}
			]
		},
		"pluginInterface": {
			"type": "object",
			"required": [
				"displayName",
				"shortDescription",
				"longDescription",
				"developerName",
				"category",
				"capabilities"
			],
			"anyOf": [
				{
					"properties": {
						"defaultPrompt": true
					},
					"required": ["defaultPrompt"]
				},
				{
					"properties": {
						"default_prompt": true
					},
					"required": ["default_prompt"]
				}
			],
			"additionalProperties": false,
			"properties": {
				"displayName": {
					"type": "string",
					"minLength": 1
				},
				"shortDescription": {
					"type": "string",
					"minLength": 1
				},
				"longDescription": {
					"type": "string",
					"minLength": 1
				},
				"developerName": {
					"type": "string",
					"minLength": 1
				},
				"category": {
					"type": "string",
					"minLength": 1
				},
				"capabilities": {
					"type": "array",
					"minItems": 1,
					"items": {
						"type": "string",
						"minLength": 1
					}
				},
				"websiteURL": {
					"$ref": "#/definitions/httpsUrl"
				},
				"privacyPolicyURL": {
					"$ref": "#/definitions/httpsUrl"
				},
				"termsOfServiceURL": {
					"$ref": "#/definitions/httpsUrl"
				},
				"defaultPrompt": {
					"$ref": "#/definitions/defaultPrompt"
				},
				"default_prompt": {
					"$ref": "#/definitions/defaultPrompt"
				},
				"brandColor": {
					"type": "string",
					"pattern": "^#[0-9A-Fa-f]{6}$"
				},
				"composerIcon": {
					"$ref": "#/definitions/assetPath"
				},
				"logo": {
					"$ref": "#/definitions/assetPath"
				},
				"logoDark": {
					"$ref": "#/definitions/assetPath",
					"description": "Optional package-relative logo asset used in dark mode."
				},
				"screenshots": {
					"type": "array",
					"items": {
						"$ref": "#/definitions/assetPath"
					}
				}
			}
		}
	}
}
